<?xml version="1.0" encoding="UTF-8"?>
<!ELEMENT listaAcciones (accion)+>
	<!ELEMENT accion (nombreAccion,listaAcciones?)>
	<!ELEMENT nombreAccion (#PCDATA)>